{"entries":[{"available_at":null,"path":".github/workflows/data-intake-tests.yml","quality":"UNKNOWN","recovery_class":"UNKNOWN","search_role":"UNKNOWN","sha256":"b08d8d3b3a79c88953e22799910c9160b97f61e937402cce1f940b7a4c0df902","size_bytes":678,"source_type":".github"},{"available_at":null,"path":".github/workflows/hub-natural-dashboard.yml","quality":"UNKNOWN","recovery_class":"UNKNOWN","search_role":"UNKNOWN","sha256":"180701ce263e798240fe5a0ef6304c91513e2b128719825aa0f40dfc96501b14","size_bytes":3143,"source_type":".github"},{"available_at":null,"path":".github/workflows/pdca-command-poller.yml","quality":"UNKNOWN","recovery_class":"UNKNOWN","search_role":"UNKNOWN","sha256":"174e8fa0d55ca74e51edab9193815c889287206c9897e4a581e063976420c422","size_bytes":1168,"source_type":".github"},{"available_at":null,"path":".github/workflows/pdca-command.yml","quality":"UNKNOWN","recovery_class":"UNKNOWN","search_role":"UNKNOWN","sha256":"d77723193ed976cb0428215cb94a8c5f473fcb36dfb12d70bc8e02e10110fdb6","size_bytes":1436,"source_type":".github"},{"available_at":null,"path":"AGENTS.md","quality":"UNKNOWN","recovery_class":"UNKNOWN","search_role":"UNKNOWN","sha256":"e9f43217c6f68b051f0555a74ead0c6281c1aa629023dfc49d6b346ef6d6c9de","size_bytes":1757,"source_type":"AGENTS.md"},{"available_at":null,"path":"artifacts/Habu_AI_OSM_Road_Grid_2026-09-25.zip.parts/README.md","quality":"UNKNOWN","recovery_class":"UNKNOWN","search_role":"UNKNOWN","sha256":"7d358f65b4584899487fb94e41235254c6ed6b4a2ca856df3b3885bebd3c8d15","size_bytes":561,"source_type":"artifacts"},{"available_at":null,"path":"artifacts/Habu_AI_OSM_Road_Grid_2026-09-25.zip.parts/part_000.b64","quality":"UNKNOWN","recovery_class":"UNKNOWN","search_role":"UNKNOWN","sha256":"3b0532e2b4824e46a8a05ad59ae4e59cbb5e9c81979c4b85ecd8101cddfbf478","size_bytes":200000,"source_type":"artifacts"},{"available_at":null,"path":"artifacts/Habu_AI_OSM_Road_Grid_2026-09-25.zip.parts/part_001.b64","quality":"UNKNOWN","recovery_class":"UNKNOWN","search_role":"UNKNOWN","sha256":"8bc93ba0c9f0d6735844079690a9d7fed05a312308d4e068fe08812f18bcaef7","size_bytes":200000,"source_type":"artifacts"},{"available_at":null,"path":"artifacts/Habu_AI_OSM_Road_Grid_2026-09-25.zip.parts/part_002.b64","quality":"UNKNOWN","recovery_class":"UNKNOWN","search_role":"UNKNOWN","sha256":"b8b83a583d51b86dac95815c686c4f4674fa1423fef026ead9f7fab4a899bad5","size_bytes":200000,"source_type":"artifacts"},{"available_at":null,"path":"artifacts/Habu_AI_OSM_Road_Grid_2026-09-25.zip.parts/part_003.b64","quality":"UNKNOWN","recovery_class":"UNKNOWN","search_role":"UNKNOWN","sha256":"5d7a86c0e14e9ca7ae0fcf11a6f4668fe08555801e442cc2b8faa372a94e6983","size_bytes":200000,"source_type":"artifacts"},{"available_at":null,"path":"artifacts/Habu_AI_OSM_Road_Grid_2026-09-25.zip.parts/part_004.b64","quality":"UNKNOWN","recovery_class":"UNKNOWN","search_role":"UNKNOWN","sha256":"54f218c5d584c263ab9e08c678aa7329523052f9b959f72723372174b6a0a004","size_bytes":200000,"source_type":"artifacts"},{"available_at":null,"path":"artifacts/Habu_AI_OSM_Road_Grid_2026-09-25.zip.parts/part_005.b64","quality":"UNKNOWN","recovery_class":"UNKNOWN","search_role":"UNKNOWN","sha256":"31eff933f8f77d1b33494f7324948596195fbbf650f6506803c3b3cf9be79802","size_bytes":200000,"source_type":"artifacts"},{"available_at":null,"path":"artifacts/Habu_AI_OSM_Road_Grid_2026-09-25.zip.parts/part_006.b64","quality":"UNKNOWN","recovery_class":"UNKNOWN","search_role":"UNKNOWN","sha256":"1615f20de7d1443abeb50682338d9335330925b7c463c23b5dd0636260fc34db","size_bytes":200000,"source_type":"artifacts"},{"available_at":null,"path":"artifacts/Habu_AI_OSM_Road_Grid_2026-09-25.zip.parts/part_007.b64","quality":"UNKNOWN","recovery_class":"UNKNOWN","search_role":"UNKNOWN","sha256":"df9746076259277ae57e660936a46b647a905324575fdcba5a0670e47d6bf98f","size_bytes":200000,"source_type":"artifacts"},{"available_at":null,"path":"artifacts/Habu_AI_OSM_Road_Grid_2026-09-25.zip.parts/part_008.b64","quality":"UNKNOWN","recovery_class":"UNKNOWN","search_role":"UNKNOWN","sha256":"b39fdb4358b73766214d1171de8ad02f282b2b55bbbf6696cbe859222a239151","size_bytes":200000,"source_type":"artifacts"},{"available_at":null,"path":"artifacts/Habu_AI_OSM_Road_Grid_2026-09-25.zip.parts/part_009.b64","quality":"UNKNOWN","recovery_class":"UNKNOWN","search_role":"UNKNOWN","sha256":"e629cfd42f694e1a837768f52a104511fc205968f8a03374bdbe9f092586a494","size_bytes":200000,"source_type":"artifacts"},{"available_at":null,"path":"artifacts/Habu_AI_OSM_Road_Grid_2026-09-25.zip.parts/part_010.b64","quality":"UNKNOWN","recovery_class":"UNKNOWN","search_role":"UNKNOWN","sha256":"1a0144962609892099f53aed4af898b6abd955ee8df01e29cdceec032dc9869e","size_bytes":200000,"source_type":"artifacts"},{"available_at":null,"path":"artifacts/Habu_AI_OSM_Road_Grid_2026-09-25.zip.parts/part_011.b64","quality":"UNKNOWN","recovery_class":"UNKNOWN","search_role":"UNKNOWN","sha256":"0963c324161ba3122a34a303428124faba2ec4220e4efa76b2905b74614d3941","size_bytes":200000,"source_type":"artifacts"},{"available_at":null,"path":"artifacts/Habu_AI_OSM_Road_Grid_2026-09-25.zip.parts/part_012.b64","quality":"UNKNOWN","recovery_class":"UNKNOWN","search_role":"UNKNOWN","sha256":"b675b7a065bb406de2776827a80ccd57b3625415cb56271a275b0b2d0304313c","size_bytes":200000,"source_type":"artifacts"},{"available_at":null,"path":"artifacts/Habu_AI_OSM_Road_Grid_2026-09-25.zip.parts/part_013.b64","quality":"UNKNOWN","recovery_class":"UNKNOWN","search_role":"UNKNOWN","sha256":"0aa421e4f2034fe14a70171971c4ffefc874e7d52f199eccb95215b0f2f8f8d8","size_bytes":200000,"source_type":"artifacts"},{"available_at":null,"path":"artifacts/Habu_AI_OSM_Road_Grid_2026-09-25.zip.parts/part_014.b64","quality":"UNKNOWN","recovery_class":"UNKNOWN","search_role":"UNKNOWN","sha256":"607511da1102049a710a83ddf9f1d144a8bde690862d1be99a1a0810ee71d49e","size_bytes":200000,"source_type":"artifacts"},{"available_at":null,"path":"artifacts/Habu_AI_OSM_Road_Grid_2026-09-25.zip.parts/part_015.b64","quality":"UNKNOWN","recovery_class":"UNKNOWN","search_role":"UNKNOWN","sha256":"61de23d57643f8196ebc13b60c07711a70bc23ff04adab5ebea612cb3f9e030b","size_bytes":200000,"source_type":"artifacts"},{"available_at":null,"path":"artifacts/Habu_AI_OSM_Road_Grid_2026-09-25.zip.parts/part_016.b64","quality":"UNKNOWN","recovery_class":"UNKNOWN","search_role":"UNKNOWN","sha256":"eaa43bd3fa53f6e1adee4ed4a55978cee083bb892064e938128a8ed135ffdef1","size_bytes":200000,"source_type":"artifacts"},{"available_at":null,"path":"artifacts/Habu_AI_OSM_Road_Grid_2026-09-25.zip.parts/part_017.b64","quality":"UNKNOWN","recovery_class":"UNKNOWN","search_role":"UNKNOWN","sha256":"12349708b5a233b419addcb55b43de3de7610cefaccc49639f326aa714409fc9","size_bytes":200000,"source_type":"artifacts"},{"available_at":null,"path":"artifacts/Habu_AI_OSM_Road_Grid_2026-09-25.zip.parts/part_018.b64","quality":"UNKNOWN","recovery_class":"UNKNOWN","search_role":"UNKNOWN","sha256":"d249140352da0a9f61755aed920e59cc48f34f0cf003fcbe144f54ce74c9bd74","size_bytes":200000,"source_type":"artifacts"},{"available_at":null,"path":"artifacts/Habu_AI_OSM_Road_Grid_2026-09-25.zip.parts/part_019.b64","quality":"UNKNOWN","recovery_class":"UNKNOWN","search_role":"UNKNOWN","sha256":"2fa8d3107b807cf8bdd94375782f2fb7b1a867aa8c701bb6bcd235e5178ebec9","size_bytes":200000,"source_type":"artifacts"},{"available_at":null,"path":"artifacts/Habu_AI_OSM_Road_Grid_2026-09-25.zip.parts/part_020.b64","quality":"UNKNOWN","recovery_class":"UNKNOWN","search_role":"UNKNOWN","sha256":"74127bafa3e2ec5ecff95c4df3b0dc91871f2ccf745dcc31bb7c53e8653d59c7","size_bytes":200000,"source_type":"artifacts"},{"available_at":null,"path":"artifacts/Habu_AI_OSM_Road_Grid_2026-09-25.zip.parts/part_021.b64","quality":"UNKNOWN","recovery_class":"UNKNOWN","search_role":"UNKNOWN","sha256":"0fc774e22cfdd7615d020469e353a8de89a6869893829dd4e0460874d0100fe8","size_bytes":200000,"source_type":"artifacts"},{"available_at":null,"path":"artifacts/Habu_AI_OSM_Road_Grid_2026-09-25.zip.parts/part_022.b64","quality":"UNKNOWN","recovery_class":"UNKNOWN","search_role":"UNKNOWN","sha256":"133e4163dbf6f5141faa2b7b9c95215c0b801193206a747d7eafb67fcfcca24f","size_bytes":200000,"source_type":"artifacts"},{"available_at":null,"path":"artifacts/Habu_AI_OSM_Road_Grid_2026-09-25.zip.parts/part_023.b64","quality":"UNKNOWN","recovery_class":"UNKNOWN","search_role":"UNKNOWN","sha256":"97cd0b45d0ea7ec969c39e1be35fc68b89e9e21c907ab4eb0221f3399c31662f","size_bytes":200000,"source_type":"artifacts"},{"available_at":null,"path":"artifacts/Habu_AI_OSM_Road_Grid_2026-09-25.zip.parts/part_024.b64","quality":"UNKNOWN","recovery_class":"UNKNOWN","search_role":"UNKNOWN","sha256":"ae358fdcf38837e5aa6c926bf36d23445d78584b3a12cbe7d631b41cd2dc48aa","size_bytes":200000,"source_type":"artifacts"},{"available_at":null,"path":"artifacts/Habu_AI_OSM_Road_Grid_2026-09-25.zip.parts/part_025.b64","quality":"UNKNOWN","recovery_class":"UNKNOWN","search_role":"UNKNOWN","sha256":"579c6410bcbd9094e9a8c7360a574d729123b9996a7021c76654b8400867ea85","size_bytes":200000,"source_type":"artifacts"},{"available_at":null,"path":"artifacts/Habu_AI_OSM_Road_Grid_2026-09-25.zip.parts/part_026.b64","quality":"UNKNOWN","recovery_class":"UNKNOWN","search_role":"UNKNOWN","sha256":"e873f7ae58fe38daea16f0f6678b054af16812488b8b791167ed266adf5fb18e","size_bytes":200000,"source_type":"artifacts"},{"available_at":null,"path":"artifacts/Habu_AI_OSM_Road_Grid_2026-09-25.zip.parts/part_027.b64","quality":"UNKNOWN","recovery_class":"UNKNOWN","search_role":"UNKNOWN","sha256":"2c016b7bdca3516f0cc64a22f8d87df2f831e9b8aa4146538373c8252b32eab5","size_bytes":200000,"source_type":"artifacts"},{"available_at":null,"path":"artifacts/Habu_AI_OSM_Road_Grid_2026-09-25.zip.parts/part_028.b64","quality":"UNKNOWN","recovery_class":"UNKNOWN","search_role":"UNKNOWN","sha256":"9a5160befea6e22d4ce4fa925b260b09499c28438babc12e25741ab29a2ea089","size_bytes":200000,"source_type":"artifacts"},{"available_at":null,"